{"spec_version":"context-layer/0.1-draft","type":"scoped_context_bundle","id":"urn:cl:bundle:test-bundle","created_at":"2026-08-20T12:00:00.000Z","issuer":{"id":"urn:cl:bundle-issuer:test"},"subject_alias":"urn:cl:alias:test-subject","request_ref":"urn:cl:request:test-request","decision_ref":"urn:cl:decision:test-decision","recipient":"urn:aaa:agent:starter","purpose":"inspect approved project context","issued_at":"2026-08-20T12:00:00.000Z","expires_at":"2026-08-20T14:00:00.000Z","context":[{"claim":"The project is on track.","predicate":"project_status","value":"on_track","confidence":0.96,"provenance_handles":["prov_status"]}],"provenance":{"prov_status":{"kind":"opaque_vault_reference","ref":"urn:cl:provenance:test-status"},"prov_unused":{"kind":"opaque_vault_reference","ref":"urn:cl:provenance:test-unused"}},"instructions":["Use approved context only.","Never resolve raw vault data."],"capabilities":["context.inspect"],"restrictions":{"onward_disclosure":"forbidden","memory_write":"proposal_only","raw_vault_resolution":"forbidden","retention_seconds":3600},"receipt_contract":{"required":true,"required_operations":["bundle.consume","context.inspect"]}}
